{
    "name": "python_prepackaged",
    "version": "3.10.15.1000",
    "query": "org.python.python_prepackaged:3.10.15.1000-*",
    "sources": [
        {
            "type": "oras",
            "repo": "ghcr",
            "rel": "artifacts/org/python/python_prepackaged",
            "oci-ref": "ghcr.io/applied-systems-biology/jipipe/artifacts/org/python/python_prepackaged"
        }
    ],
    "maintainer": {
        "name": "Ruman Gerst",
        "email": "ruman.gerst@leibniz-hki.de"
    },
    "description": "Standalone Python distribution",
    "homepage": "https://github.com/applied-systems-biology/jipipe",
    "license": "MPL-2.0",
    "tags": [
        "3.10.15.1000-windows_amd64",
        "3.10.15.1000-macos_amd64",
        "3.10.15.1000-macos_arm64",
        "3.10.15.1000-linux_amd64"
    ],
    "includes": {
        "pip": [
            "asciitree==0.3.3",
            "contourpy==1.3.0",
            "cycler==0.12.1",
            "fasteners==0.19",
            "filelock==3.13.1",
            "fonttools==4.53.1",
            "fsspec==2024.2.0",
            "imageio==2.35.1",
            "Jinja2==3.1.3",
            "joblib==1.4.2",
            "kiwisolver==1.4.7",
            "lazy_loader==0.4",
            "looseversion==1.3.0",
            "MarkupSafe==2.1.5",
            "matplotlib==3.9.2",
            "mpmath==1.3.0",
            "networkx==3.3",
            "numcodecs==0.13.0",
            "numpy==2.1.1",
            "opencv-python==4.10.0.84",
            "packaging==24.1",
            "pandas==2.2.2",
            "patsy==0.5.6",
            "pillow==10.4.0",
            "plotly==5.24.1",
            "Pygments==2.18.0",
            "pyparsing==3.1.4",
            "python-dateutil==2.9.0.post0",
            "pytz==2024.2",
            "PyYAML==6.0.2",
            "scikit-image==0.24.0",
            "scikit-learn==1.5.2",
            "scipy==1.14.1",
            "seaborn==0.13.2",
            "SimpleITK==2.4.0",
            "six==1.16.0",
            "statsmodels==0.14.3",
            "sympy==1.12",
            "tenacity==9.0.0",
            "threadpoolctl==3.5.0",
            "tifffile==2024.8.30",
            "torch==2.4.1+cpu",
            "torchaudio==2.4.1+cpu",
            "torchvision==0.19.1+cpu",
            "trackpy==0.6.4",
            "typing_extensions==4.12.2",
            "tzdata==2024.1",
            "vedo==2024.5.2",
            "vtk==9.3.1",
            "zarr==2.18.3"
        ]
    }
}