{
    "name": "r_prepackaged",
    "version": "4.4.0.1001",
    "query": "org.r.r_prepackaged:4.4.0.1001-*",
    "sources": [
        {
            "type": "oras",
            "repo": "ghcr",
            "rel": "artifacts/org/r/r_prepackaged",
            "oci-ref": "ghcr.io/applied-systems-biology/jipipe/artifacts/org/r/r_prepackaged"
        }
    ],
    "maintainer": {
        "name": "Ruman Gerst",
        "email": "ruman.gerst@leibniz-hki.de"
    },
    "description": "Standalone R distribution",
    "homepage": "https://github.com/applied-systems-biology/jipipe",
    "license": "GPL-3",
    "tags": [
        "4.4.0.1001-windows_amd64",
        "4.4.0.1001-linux_amd64_wine",
        "4.4.0.1001-macos_amd64_wine"
    ],
    "includes": {
        "cran": [
            "abind",
            "askpass",
            "backports",
            "base64enc",
            "bit",
            "bit64",
            "blob",
            "brio",
            "broom",
            "bslib",
            "cachem",
            "callr",
            "car",
            "carData",
            "caret",
            "cellranger",
            "cli",
            "clipr",
            "clock",
            "colorspace",
            "conflicted",
            "cpp11",
            "crayon",
            "curl",
            "data.table",
            "DBI",
            "dbplyr",
            "desc",
            "diagram",
            "dials",
            "DiceDesign",
            "diffobj",
            "digest",
            "doFuture",
            "dplyr",
            "dtplyr",
            "e1071",
            "ellipsis",
            "evaluate",
            "fansi",
            "farver",
            "fastmap",
            "fontawesome",
            "forcats",
            "foreach",
            "fs",
            "furrr",
            "future",
            "future.apply",
            "gargle",
            "generics",
            "ggforce",
            "ggplot2",
            "ggraph",
            "ggrepel",
            "globals",
            "glue",
            "googledrive",
            "googlesheets4",
            "gower",
            "GPfit",
            "graphlayouts",
            "gridExtra",
            "gtable",
            "hardhat",
            "haven",
            "highr",
            "hms",
            "htmltools",
            "httr",
            "ids",
            "igraph",
            "infer",
            "ipred",
            "isoband",
            "iterators",
            "jquerylib",
            "jsonlite",
            "knitr",
            "labeling",
            "lava",
            "lhs",
            "lifecycle",
            "listenv",
            "lme4",
            "lubridate",
            "magrittr",
            "MatrixModels",
            "memoise",
            "mime",
            "minqa",
            "modeldata",
            "modelenv",
            "ModelMetrics",
            "modelr",
            "multcomp",
            "munsell",
            "mvtnorm",
            "nloptr",
            "numDeriv",
            "openssl",
            "parallelly",
            "parsnip",
            "patchwork",
            "pbkrtest",
            "pillar",
            "pkgbuild",
            "pkgconfig",
            "pkgload",
            "plyr",
            "polyclip",
            "praise",
            "prettyunits",
            "pROC",
            "processx",
            "prodlim",
            "progress",
            "progressr",
            "proxy",
            "ps",
            "purrr",
            "quantreg",
            "R6",
            "ragg",
            "rappdirs",
            "RColorBrewer",
            "Rcpp",
            "RcppArmadillo",
            "RcppEigen",
            "readr",
            "readxl",
            "recipes",
            "rematch",
            "rematch2",
            "reprex",
            "reshape2",
            "rjson",
            "rlang",
            "rmarkdown",
            "rprojroot",
            "rsample",
            "rstudioapi",
            "rvest",
            "sandwich",
            "sass",
            "scales",
            "selectr",
            "shape",
            "slider",
            "SparseM",
            "SQUAREM",
            "stringi",
            "stringr",
            "sys",
            "systemfonts",
            "testthat",
            "textshaping",
            "TH.data",
            "tibble",
            "tidygraph",
            "tidymodels",
            "tidyr",
            "tidyselect",
            "tidyverse",
            "timechange",
            "timeDate",
            "tinytex",
            "tune",
            "tweenr",
            "tzdb",
            "utf8",
            "uuid",
            "vctrs",
            "viridis",
            "viridisLite",
            "vroom",
            "waldo",
            "warp",
            "withr",
            "workflows",
            "workflowsets",
            "xfun",
            "xml2",
            "yaml",
            "yardstick",
            "zoo"
        ]
    }
}