{
    "name": "oras",
    "version": "1.3.0",
    "query": "land.oras.oras:1.3.0-*",
    "sources": [
        {
            "type": "http",
            "repo": "main",
            "urls": {
                "1.3.0-linux_amd64": "https://github.com/oras-project/oras/releases/download/v1.3.0/oras_1.3.0_linux_amd64.tar.gz",
                "1.3.0-macos_amd64": "https://github.com/oras-project/oras/releases/download/v1.3.0/oras_1.3.0_darwin_amd64.tar.gz",
                "1.3.0-macos-arm64": "https://github.com/oras-project/oras/releases/download/v1.3.0/oras_1.3.0_darwin_arm64.tar.gz",
                "1.3.0-windows_amd64": "https://github.com/oras-project/oras/releases/download/v1.3.0/oras_1.3.0_windows_amd64.zip"
            }
        }
    ],
    "maintainer": {
        "name": "Ruman Gerst",
        "email": "ruman.gerst@leibniz-hki.de"
    },
    "description": "Download for ORAS",
    "homepage": "https://oras.land/",
    "license": "Apache-2.0",
    "tags": [
        "1.3.0-linux_amd64",
        "1.3.0-macos_amd64",
        "1.3.0-macos-arm64",
        "1.3.0-windows_amd64"
    ]
}